<!ELEMENT BIBLIO (LIVRE*) >

	<!ELEMENT LIVRE (TITRE,AUTEUR) >
		<!ELEMENT TITRE  (#PCDATA)     >
		<!ELEMENT AUTEUR (NOM,PRENOM)  >
		
			<!ELEMENT NOM    (#PCDATA) >
			<!ELEMENT PRENOM (#PCDATA) >
